{
  "formatVersion": 1,
  "generatedAt": "2026-10-19T18:11:44Z",
  "platform": "macos",
  "channels": {
    "beta": {
      "versionName": "1.9.1",
      "title": "VIME macOS v1.9.1 beta · build 2026102001 · macOS 14+ · 已通过 macOS 安全检查",
      "summary": "# Vime 1.9.1 公测更新\n\n构建号：2026102001 · macOS 14+\n\n- 修复逐个念出常见技术缩写的字母后，整理成 API、SDK 等规范缩写可能导致结果退回原话的问题。\n- 改进整理回退的问题分类，便于准确定位原因。\n- 改进诊断隐私保护，避免在公开诊断字段中出现口述内容片段。\n\n保留现有输入能力、个人设置和历史记录；实验室功能继续默认关闭，不改变服务地址、识别模型或整理提示内容。\n\n本次不包含离线语音识别研究或其他未验收候选，不宣称长文整理成功率已经提升。\n\n建议更新，不新增强制升级；旧版安装包保留。",
      "releaseUrl": "https://github.com/imkida/V_IME_releases/releases/tag/macos-v1.9.1",
      "mandatory": false,
      "buildNumber": 2026102001,
      "minSystemVersion": "14.0",
      "assets": [
        {
          "name": "V_IME-1.9.1-2026102001-macos.dmg",
          "url": "https://vime-public-releases-cn-shanghai.oss-cn-shanghai.aliyuncs.com/macos/1.9.1/2026102001/V_IME-1.9.1-2026102001-macos.dmg",
          "sha256": "3a645caea5eefe9bcf5c7bcf6ba32e0327afddbda63453cc94288bdc9e3c12fd",
          "mirrorUrl": "https://github.com/imkida/V_IME_releases/releases/download/macos-v1.9.1/V_IME-1.9.1-2026102001-macos.dmg",
          "sizeBytes": 12655347,
          "installerType": "dmg",
          "arch": "universal",
          "minSystemVersion": "14.0"
        },
        {
          "name": "V_IME-1.9.1-2026102001-macos.zip",
          "url": "https://vime-public-releases-cn-shanghai.oss-cn-shanghai.aliyuncs.com/macos/1.9.1/2026102001/V_IME-1.9.1-2026102001-macos.zip",
          "sha256": "1e0850b455692f9bc9229b6d88fbf978bceb6e44c3fb8295d880efc7ce4adf71",
          "mirrorUrl": "https://github.com/imkida/V_IME_releases/releases/download/macos-v1.9.1/V_IME-1.9.1-2026102001-macos.zip",
          "sizeBytes": 11335018,
          "installerType": "zip",
          "arch": "universal",
          "minSystemVersion": "14.0",
          "sparkleEdDsaSignature": "mYs+FMVgfS6R7te5rO0+H/FaYzU3QvJ2bxgr6/TMQQhyB/aZ5ZKiklfnsNl6eysnRNemH6ZuHdJ1Be4loT1XCA=="
        }
      ],
      "appcastUrl": "https://imkida.github.io/V_IME_releases/macos/beta/appcast.xml",
      "sparkleEdDsaSignature": "mYs+FMVgfS6R7te5rO0+H/FaYzU3QvJ2bxgr6/TMQQhyB/aZ5ZKiklfnsNl6eysnRNemH6ZuHdJ1Be4loT1XCA=="
    }
  },
  "productName": "VIME",
  "bundleId": "com.vime.app.macos"
}
